{
  "allowed_document_ids": [
    "doc_v14_gotion_2024fy"
  ],
  "allowed_evidence_chunk_ids": [
    "chunk_v14_gotion_2024fy_synthetic_financial_summary"
  ],
  "allowed_financial_fact_ids": [
    "fact_v14_gotion_2024fy_accounts_receivable",
    "fact_v14_gotion_2024fy_inventory",
    "fact_v14_gotion_2024fy_net_income",
    "fact_v14_gotion_2024fy_operating_cash_flow",
    "fact_v14_gotion_2024fy_operating_cost",
    "fact_v14_gotion_2024fy_revenue"
  ],
  "benchmark_focus": "earnings_quality",
  "case_id": "case_val_gotion_2024fy",
  "company": {
    "company_id": "cn_002074",
    "country_code": "CN",
    "exchange": "SZSE",
    "legal_name": "国轩高科股份有限公司",
    "ticker": "002074"
  },
  "created_at": "2026-09-01T05:30:00+08:00",
  "frozen": true,
  "group_key": "cn_002074",
  "package_hash": "181439808bc597c20b159cc1546c19cc36a4187cd35fb1f7ade1611ff875e054",
  "package_id": "package_v1_4_primary_battery_earnings_quality",
  "research_question": "该报告期的利润是否转化为高质量经营现金流?请核对应收账款、存货、现金转化、利润现金背离、一次性贡献和反证。",
  "research_time": "2025-04-26T00:00:00+08:00",
  "schema_version": "1.4.0",
  "sealed": false,
  "split": "validation",
  "target_periods": [
    {
      "accounting_standard": "CAS",
      "fiscal_period": "FY",
      "fiscal_year": 2024,
      "period_basis": "ytd",
      "period_end": "2024-12-31",
      "period_start": "2024-01-01",
      "restatement_status": "as_reported",
      "statement_scope": "consolidated"
    }
  ],
  "verifier_ground_truth_ref": {
    "access_class": "verifier_only",
    "artifact_hash": "4c76b308e583f06f0d0d148ba1141f3ba7d6e709d676cfb64d1540f43fcc6549",
    "artifact_id": "ground_truth_case_val_gotion_2024fy"
  }
}
