{
  "allowed_document_ids": [
    "doc_v14_sunwoda_2024h1"
  ],
  "allowed_evidence_chunk_ids": [
    "chunk_v14_sunwoda_2024h1_synthetic_financial_summary"
  ],
  "allowed_financial_fact_ids": [
    "fact_v14_sunwoda_2024h1_accounts_receivable",
    "fact_v14_sunwoda_2024h1_inventory",
    "fact_v14_sunwoda_2024h1_net_income",
    "fact_v14_sunwoda_2024h1_operating_cash_flow",
    "fact_v14_sunwoda_2024h1_operating_cost",
    "fact_v14_sunwoda_2024h1_revenue"
  ],
  "benchmark_focus": "earnings_quality",
  "case_id": "case_final_sunwoda_2024h1",
  "company": {
    "company_id": "cn_300207",
    "country_code": "CN",
    "exchange": "SZSE",
    "legal_name": "欣旺达电子股份有限公司",
    "ticker": "300207"
  },
  "created_at": "2026-09-01T05:30:00+08:00",
  "frozen": true,
  "group_key": "cn_300207",
  "package_hash": "181439808bc597c20b159cc1546c19cc36a4187cd35fb1f7ade1611ff875e054",
  "package_id": "package_v1_4_primary_battery_earnings_quality",
  "research_question": "该报告期的利润是否转化为高质量经营现金流?请核对应收账款、存货、现金转化、利润现金背离、一次性贡献和反证。",
  "research_time": "2024-08-31T00:00:00+08:00",
  "schema_version": "1.4.0",
  "sealed": true,
  "split": "final_test",
  "target_periods": [
    {
      "accounting_standard": "CAS",
      "fiscal_period": "H1",
      "fiscal_year": 2024,
      "period_basis": "ytd",
      "period_end": "2024-06-30",
      "period_start": "2024-01-01",
      "restatement_status": "as_reported",
      "statement_scope": "consolidated"
    }
  ],
  "verifier_ground_truth_ref": {
    "access_class": "verifier_only",
    "artifact_hash": "06ed607e142224cb72c0b62b6309a9c8e99e18170dc13d2066953cc3b3289325",
    "artifact_id": "ground_truth_case_final_sunwoda_2024h1"
  }
}
