{
  "allowed_document_ids": [
    "doc_g0_catl_2023q3"
  ],
  "allowed_evidence_chunk_ids": [
    "chunk_g0_catl_2023q3_synthetic_financial_summary"
  ],
  "allowed_financial_fact_ids": [
    "fact_g0_catl_2023q3_accounts_receivable",
    "fact_g0_catl_2023q3_inventory",
    "fact_g0_catl_2023q3_net_income",
    "fact_g0_catl_2023q3_operating_cash_flow",
    "fact_g0_catl_2023q3_operating_cost",
    "fact_g0_catl_2023q3_revenue"
  ],
  "benchmark_focus": "earnings_quality",
  "case_id": "case_evo_catl_2023q3",
  "company": {
    "company_id": "cn_300750",
    "country_code": "CN",
    "exchange": "SZSE",
    "legal_name": "宁德时代新能源科技股份有限公司",
    "ticker": "300750"
  },
  "created_at": "2026-09-01T05:30:00+08:00",
  "frozen": true,
  "group_key": "cn_300750",
  "package_hash": "181439808bc597c20b159cc1546c19cc36a4187cd35fb1f7ade1611ff875e054",
  "package_id": "package_v1_4_primary_battery_earnings_quality",
  "research_question": "该报告期的利润是否转化为高质量经营现金流?请核对应收账款、存货、现金转化、利润现金背离、一次性贡献和反证。",
  "research_time": "2023-10-21T00:00:00+08:00",
  "schema_version": "1.4.0",
  "sealed": false,
  "split": "evolution",
  "target_periods": [
    {
      "accounting_standard": "CAS",
      "fiscal_period": "Q3",
      "fiscal_year": 2023,
      "period_basis": "ytd",
      "period_end": "2023-09-30",
      "period_start": "2023-01-01",
      "restatement_status": "as_reported",
      "statement_scope": "consolidated"
    }
  ],
  "verifier_ground_truth_ref": {
    "access_class": "verifier_only",
    "artifact_hash": "20cd0aae40e8bb7607e44cd0253b1797c153fea7f13865919c5d33338a863bc7",
    "artifact_id": "ground_truth_case_evo_catl_2023q3"
  }
}
