{
  "allowed_document_ids": [
    "doc_v14_catl_2024q3"
  ],
  "allowed_evidence_chunk_ids": [
    "chunk_v14_catl_2024q3_synthetic_financial_summary"
  ],
  "allowed_financial_fact_ids": [
    "fact_v14_catl_2024q3_accounts_receivable",
    "fact_v14_catl_2024q3_inventory",
    "fact_v14_catl_2024q3_net_income",
    "fact_v14_catl_2024q3_operating_cash_flow",
    "fact_v14_catl_2024q3_operating_cost",
    "fact_v14_catl_2024q3_revenue"
  ],
  "benchmark_focus": "earnings_quality",
  "case_id": "case_evo_catl_2024q3",
  "company": {
    "company_id": "cn_300750",
    "country_code": "CN",
    "exchange": "SZSE",
    "legal_name": "宁德时代新能源科技股份有限公司",
    "ticker": "300750"
  },
  "created_at": "2026-09-01T05:30:00+08:00",
  "frozen": true,
  "group_key": "cn_300750",
  "package_hash": "3638eb1ca7b8192cb6a901f4b0d51c8373ccaff1e776758605f1d4b975cb1c3f",
  "package_id": "package_v1_4_primary_battery_earnings_quality",
  "research_question": "该报告期的利润是否转化为高质量经营现金流?请核对应收账款、存货、现金转化、利润现金背离、一次性贡献和反证。",
  "research_time": "2024-10-20T00:00:00+08:00",
  "schema_version": "1.4.0",
  "sealed": false,
  "split": "evolution",
  "target_periods": [
    {
      "accounting_standard": "CAS",
      "fiscal_period": "Q3",
      "fiscal_year": 2024,
      "period_basis": "ytd",
      "period_end": "2024-09-30",
      "period_start": "2024-01-01",
      "restatement_status": "as_reported",
      "statement_scope": "consolidated"
    }
  ],
  "verifier_ground_truth_ref": {
    "access_class": "verifier_only",
    "artifact_hash": "d63c6485026d6f82112c879a1c4a160e862c7e035098abd99a6bafdd6ee8b46c",
    "artifact_id": "ground_truth_case_evo_catl_2024q3"
  }
}
