{
  "allowed_document_ids": [
    "doc_v15_farasis_2024q1"
  ],
  "allowed_evidence_chunk_ids": [
    "chunk_v15_farasis_2024q1_synthetic_financial_summary"
  ],
  "allowed_financial_fact_ids": [
    "fact_v15_farasis_2024q1_accounts_receivable",
    "fact_v15_farasis_2024q1_inventory",
    "fact_v15_farasis_2024q1_net_income",
    "fact_v15_farasis_2024q1_operating_cash_flow",
    "fact_v15_farasis_2024q1_operating_cost",
    "fact_v15_farasis_2024q1_revenue"
  ],
  "benchmark_focus": "earnings_quality",
  "case_id": "case_evo_farasis_2024q1",
  "company": {
    "company_id": "cn_688567",
    "country_code": "CN",
    "exchange": "SSE",
    "legal_name": "孚能科技（赣州）股份有限公司",
    "ticker": "688567"
  },
  "created_at": "2026-09-01T14:30:00+08:00",
  "frozen": true,
  "group_key": "cn_688567",
  "package_hash": "ba95986b94d416e7c5d3960749d253463d61161ca081b3454c4428b6344c93f4",
  "package_id": "package_v1_5_contingency_battery_earnings_quality",
  "research_question": "该报告期的利润是否转化为高质量经营现金流?请核对应收账款、存货、现金转化、利润现金背离、一次性贡献和反证。",
  "research_time": "2024-05-01T00:00:00+08:00",
  "schema_version": "1.4.0",
  "sealed": false,
  "split": "evolution",
  "target_periods": [
    {
      "accounting_standard": "CAS",
      "fiscal_period": "Q1",
      "fiscal_year": 2024,
      "period_basis": "ytd",
      "period_end": "2024-03-31",
      "period_start": "2024-01-01",
      "restatement_status": "as_reported",
      "statement_scope": "consolidated"
    }
  ],
  "verifier_ground_truth_ref": {
    "access_class": "verifier_only",
    "artifact_hash": "8e708f8852021e6c9e90f26979d46d8ee42671fbc985de4df017aaa9a371c515",
    "artifact_id": "ground_truth_case_evo_farasis_2024q1"
  }
}
