{
  "allowed_document_ids": [
    "doc_v14_sunwoda_2023fy"
  ],
  "allowed_evidence_chunk_ids": [
    "chunk_v14_sunwoda_2023fy_synthetic_financial_summary"
  ],
  "allowed_financial_fact_ids": [
    "fact_v14_sunwoda_2023fy_accounts_receivable",
    "fact_v14_sunwoda_2023fy_inventory",
    "fact_v14_sunwoda_2023fy_net_income",
    "fact_v14_sunwoda_2023fy_operating_cash_flow",
    "fact_v14_sunwoda_2023fy_operating_cost",
    "fact_v14_sunwoda_2023fy_revenue"
  ],
  "benchmark_focus": "earnings_quality",
  "case_id": "case_final_sunwoda_2023fy",
  "company": {
    "company_id": "cn_300207",
    "country_code": "CN",
    "exchange": "SZSE",
    "legal_name": "欣旺达电子股份有限公司",
    "ticker": "300207"
  },
  "created_at": "2026-09-01T05:30:00+08:00",
  "frozen": true,
  "group_key": "cn_300207",
  "package_hash": "3638eb1ca7b8192cb6a901f4b0d51c8373ccaff1e776758605f1d4b975cb1c3f",
  "package_id": "package_v1_4_primary_battery_earnings_quality",
  "research_question": "该报告期的利润是否转化为高质量经营现金流?请核对应收账款、存货、现金转化、利润现金背离、一次性贡献和反证。",
  "research_time": "2024-04-12T00:00:00+08:00",
  "schema_version": "1.4.0",
  "sealed": true,
  "split": "final_test",
  "target_periods": [
    {
      "accounting_standard": "CAS",
      "fiscal_period": "FY",
      "fiscal_year": 2023,
      "period_basis": "ytd",
      "period_end": "2023-12-31",
      "period_start": "2023-01-01",
      "restatement_status": "as_reported",
      "statement_scope": "consolidated"
    }
  ],
  "verifier_ground_truth_ref": {
    "access_class": "verifier_only",
    "artifact_hash": "058d55a9e5cf112422a467be7bf976f495260f1cc579dd5dbd538409b76ef898",
    "artifact_id": "ground_truth_case_final_sunwoda_2023fy"
  }
}
